{
  "$schema": "https://json-schema.org/draft/2020-12/schema",
  "$id": "https://veritas.local/contracts/claim.schema.json",
  "description": "Immutable, versioned claim. Every revision is a new object; correction creates new revision with SUPERSEDES. One verifiable proposition per claim. Exact source span and byte/content digest preserved before normalization. Epistemic type never auto-promoted.",
  "title": "Veritas Claim (S2-004)",
  "type": "object",
  "additionalProperties": false,
  "required": [
    "contractVersion",
    "claim_id",
    "revision",
    "workspace_id",
    "tenant_id",
    "epistemic_type",
    "polarity",
    "normalized_text",
    "original_text",
    "subject",
    "predicate",
    "object",
    "units",
    "value_range",
    "population",
    "geography",
    "period",
    "event_time",
    "published_at",
    "observed_at",
    "fetched_at",
    "language",
    "translation_status",
    "canonical_digest",
    "lifecycle",
    "created_at",
    "created_by"
  ],
  "properties": {
    "contractVersion": { "const": "1.0.0" },
    "claim_id": { "$ref": "#/$defs/claimId" },
    "revision": { "type": "integer", "minimum": 1 },
    "workspace_id": { "$ref": "#/$defs/workspaceId" },
    "tenant_id": { "$ref": "#/$defs/tenantId" },
    "acl": {
      "type": "object",
      "additionalProperties": false,
      "required": ["visibility", "workspace_id", "tenant_id"],
      "properties": {
        "visibility": { "enum": ["public", "project", "private"] },
        "workspace_id": { "$ref": "#/$defs/workspaceId" },
        "tenant_id": { "$ref": "#/$defs/tenantId" },
        "allowed_workspace_ids": {
          "type": "array",
          "items": { "$ref": "#/$defs/workspaceId" },
          "uniqueItems": true
        },
        "allowed_principal_ids": {
          "type": "array",
          "items": { "$ref": "#/$defs/principalId" },
          "uniqueItems": true
        }
      }
    },
    "epistemic_type": {
      "enum": [
        "OBSERVATION",
        "FACT_CLAIM",
        "EXPERT_OPINION",
        "HYPOTHESIS",
        "FORECAST",
        "ANALOGY",
        "MECHANISM_CLAIM"
      ]
    },
    "polarity": {
      "description": "Machine-checkable negation. Losing a negation is a hard fail (§11); polarity is never inferred from lifecycle or trust.",
      "enum": ["affirmative", "negated"]
    },
    "modality": {
      "description": "Epistemic modal marking of the proposition; preserved, never dropped.",
      "oneOf": [
        { "enum": ["indicative", "possibility", "necessity", "conditional"] },
        { "type": "null" }
      ]
    },
    "denominator": {
      "description": "Explicit denominator of a ratio/percentage (§4: denominators must not be lost).",
      "oneOf": [
        { "type": "string", "maxLength": 512 },
        { "type": "null" }
      ]
    },
    "translation_provenance": {
      "description": "Required when translation_status = translated. A translation is a new version with its own translator/model provenance and never replaces the original.",
      "oneOf": [
        {
          "type": "object",
          "additionalProperties": false,
          "required": ["translator", "translator_version", "source_claim_id"],
          "properties": {
            "translator": { "type": "string", "maxLength": 128 },
            "translator_version": { "type": "string", "pattern": "^\\d+\\.\\d+\\.\\d+$" },
            "translator_config_digest": { "$ref": "#/$defs/sha256Hex" },
            "source_claim_id": { "$ref": "#/$defs/claimId" }
          }
        },
        { "type": "null" }
      ]
    },
    "normalized_text": { "type": "string", "minLength": 1, "maxLength": 8192 },
    "original_text": { "type": "string", "minLength": 1, "maxLength": 8192 },
    "subject": { "type": "string", "minLength": 1, "maxLength": 512 },
    "predicate": { "type": "string", "minLength": 1, "maxLength": 512 },
    "object": { "type": "string", "minLength": 1, "maxLength": 512 },
    "qualifiers": {
      "type": "array",
      "items": { "type": "string", "maxLength": 256 },
      "uniqueItems": true
    },
    "uncertainty": {
      "type": "object",
      "additionalProperties": false,
      "properties": {
        "type": { "enum": ["aleatory", "epistemic", "both"] },
        "description": { "type": "string", "maxLength": 1024 }
      }
    },
    "method": {
      "type": "object",
      "additionalProperties": false,
      "properties": {
        "name": { "type": "string", "maxLength": 256 },
        "version": { "type": "string", "pattern": "^\\d+\\.\\d+\\.\\d+$" },
        "config_digest": { "$ref": "#/$defs/sha256Hex" }
      }
    },
    "assumptions": {
      "type": "array",
      "items": { "type": "string", "maxLength": 1024 },
      "uniqueItems": true
    },
    "exclusions": {
      "type": "array",
      "items": { "type": "string", "maxLength": 1024 },
      "uniqueItems": true
    },
    "units": {
      "oneOf": [
        { "type": "string", "maxLength": 128 },
        { "type": "null" }
      ]
    },
    "value_range": {
      "oneOf": [
        {
          "type": "object",
          "additionalProperties": false,
          "required": ["min", "max"],
          "properties": {
            "min": { "type": "number" },
            "max": { "type": "number" }
          }
        },
        { "type": "null" }
      ]
    },
    "population": {
      "oneOf": [
        { "type": "string", "maxLength": 512 },
        { "type": "null" }
      ]
    },
    "geography": {
      "oneOf": [
        { "type": "string", "maxLength": 512 },
        { "type": "null" }
      ]
    },
    "period": {
      "oneOf": [
        {
          "type": "object",
          "additionalProperties": false,
          "required": ["start", "end"],
          "properties": {
            "start": {
              "oneOf": [
                { "$ref": "#/$defs/utcTimestamp" },
                { "type": "null" }
              ]
            },
            "end": {
              "oneOf": [
                { "$ref": "#/$defs/utcTimestamp" },
                { "type": "null" }
              ]
            }
          }
        },
        { "type": "null" }
      ]
    },
    "event_time": {
      "oneOf": [
        { "$ref": "#/$defs/utcTimestamp" },
        { "type": "null" }
      ]
    },
    "published_at": {
      "oneOf": [
        { "$ref": "#/$defs/utcTimestamp" },
        { "type": "null" }
      ]
    },
    "observed_at": { "$ref": "#/$defs/utcTimestamp" },
    "fetched_at": { "$ref": "#/$defs/utcTimestamp" },
    "language": {
      "type": "string",
      "pattern": "^[a-z]{2,3}(-[A-Za-z0-9]{2,8})?$"
    },
    "translation_status": {
      "enum": ["original", "translated", "translation_pending"]
    },
    "canonical_digest": { "$ref": "#/$defs/sha256Hex" },
    "lifecycle": {
      "enum": [
        "PROPOSED",
        "QUARANTINED",
        "REVIEWED",
        "ACCEPTED_BOUNDED",
        "REJECTED",
        "STALE",
        "REVOKED",
        "SUPERSEDED"
      ]
    },
    "supersedes_claim_id": {
      "oneOf": [
        { "$ref": "#/$defs/claimId" },
        { "type": "null" }
      ]
    },
    "supersedes_revision": {
      "oneOf": [
        { "type": "integer", "minimum": 1 },
        { "type": "null" }
      ]
    },
    "created_at": { "$ref": "#/$defs/utcTimestamp" },
    "created_by": { "$ref": "#/$defs/principalId" }
  },
  "allOf": [
    {
      "if": { "properties": { "lifecycle": { "const": "SUPERSEDED" } } },
      "then": {
        "required": ["supersedes_claim_id", "supersedes_revision"],
        "properties": {
          "supersedes_claim_id": { "$ref": "#/$defs/claimId" },
          "supersedes_revision": { "type": "integer", "minimum": 1 }
        }
      }
    },
    {
      "if": { "properties": { "translation_status": { "const": "translated" } } },
      "then": {
        "required": ["translation_provenance"],
        "properties": { "translation_provenance": { "type": "object" } }
      }
    },
    {
      "if": { "properties": { "translation_status": { "const": "original" } } },
      "then": { "properties": { "translation_provenance": { "type": "null" } } }
    }
  ],
  "$defs": {
    "utcTimestamp": {
      "type": "string",
      "pattern": "^\\d{4}-\\d{2}-\\d{2}T\\d{2}:\\d{2}:\\d{2}\\.\\d{3}Z$"
    },
    "sha256Hex": { "type": "string", "pattern": "^[0-9a-f]{64}$" },
    "claimId": { "type": "string", "pattern": "^clm-[a-z0-9][a-z0-9-]{0,62}$" },
    "workspaceId": { "type": "string", "pattern": "^ws-[a-z0-9][a-z0-9-]{0,62}$" },
    "tenantId": { "type": "string", "pattern": "^tn-[a-z0-9][a-z0-9-]{0,62}$" },
    "principalId": { "type": "string", "pattern": "^prn-[a-z0-9][a-z0-9-]{0,62}$" }
  }
}