{
  "contractVersion": "1.0.0",
  "claim_id": "clm-canonical-0001",
  "revision": 1,
  "workspace_id": "ws-verifier",
  "tenant_id": "tn-verifier",
  "epistemic_type": "FACT_CLAIM",
  "polarity": "affirmative",
  "normalized_text": "Wind and solar generated 22% of EU electricity in 2024.",
  "original_text": "Wind and solar generated 22% of EU electricity in 2024.",
  "subject": "Wind and solar generation",
  "predicate": "generated",
  "object": "22% of EU electricity",
  "units": "%",
  "value_range": {
    "min": 22,
    "max": 22
  },
  "population": null,
  "geography": "EU",
  "period": {
    "start": "2024-01-01T00:00:00.000Z",
    "end": "2024-12-31T23:59:59.999Z"
  },
  "event_time": null,
  "published_at": "2026-01-15T00:00:00.000Z",
  "observed_at": "2026-01-15T00:00:00.000Z",
  "fetched_at": "2026-01-16T00:00:00.000Z",
  "language": "en",
  "translation_status": "original",
  "canonical_digest": "57747768914aeb493a70b09ec6cb4d2a47a78af9251a8d2b9c4b7273e63a5e09",
  "lifecycle": "PROPOSED",
  "created_at": "2026-01-16T00:00:00.000Z",
  "created_by": "prn-extractor-1"
}
